17981987,,,GFP,,http://www.ncbi.nlm.nih.gov/pubmed/17981987,2008,"Chary SN, et al.",Trehalose-6-phosphate synthase/phosphatase regulates cell shape and plant architecture in Arabidopsis
ISI:000234543100010,,,GFP,,http://dx.doi.org/10.1111/j.1744-7909.2006.00202.x,2006,"Burk DH, et al.",Disruption of cortical microtubules by overexpression of green fluorescent protein-tagged alpha-tubulin 6 causes a marked reduction in cell wall synthesis
23766354,,,GFP,,http://www.ncbi.nlm.nih.gov/pubmed/23766354,2013,"Garcia-Molina A, et al.",The Arabidopsis COPT6 transport protein functions in copper distribution under copper-deficient conditions.
16699542,,,GFP,,http://www.ncbi.nlm.nih.gov/pubmed/16699542,2006,"Ma H, et al.",MORN motifs in plant PIPKs are involved in the regulation of subcellular localization and phospholipid binding
16699543,,,GFP,,http://www.ncbi.nlm.nih.gov/pubmed/16699543,2006,"Fong PM, et al.",Arabidopsis thaliana histone deacetylase 1 (AtHD1) is localized in euchromatic regions and demonstrates histone deacetylase activity in vitro
15548735,,,GFP,,http://www.ncbi.nlm.nih.gov/pubmed/15548735,2004,"Patel S, et al.",Arabidopsis WPP-domain proteins are developmentally associated with the nuclear envelope and promote cell division
24957336,,,GFP,,http://dx.doi.org/10.7554/eLife.01990,2014,Liu X et al.,Host-induced bacterial cell wall decomposition mediates pattern-triggered immunity in Arabidopsis.
15228386,,,GFP,,http://www.ncbi.nlm.nih.gov/pubmed/15228386,2004,"Wormit A, et al.",Characterization of three novel members of the Arabidopsis thaliana equilibrative nucleoside transporter (ENT) family
25819795,,,GFP,,http://doi.org/10.1534/genetics.115.176438,2015,Sasaki T et al.,An Rtf2 Domain-Containing Protein Influences Pre-mRNA Splicing and Is Essential for Embryonic Development in Arabidopsis thaliana.
17259260,,,GFP,,http://www.ncbi.nlm.nih.gov/pubmed/17259260,2007,"Endo M, et al.",CRYPTOCHROME2 in vascular bundles regulates flowering in Arabidopsis
10751170,,,GFP,,http://www.ncbi.nlm.nih.gov/pubmed/10751170,2000,"Springer PS, et al.",The essential Mcm7 protein PROLIFERA is localized to the nucleus of dividing cells during the G(1) phase and is required maternally for early Arabidopsis development
16923014,,,MS/MS,,http://www.ncbi.nlm.nih.gov/pubmed/16923014,2006,"Goulas E, et al.",The chloroplast lumen and stromal proteomes of Arabidopsis thaliana show differential sensitivity to short- and long-term exposure to low temperature
24381066,,,GFP,,http://www.ncbi.nlm.nih.gov/pubmed/24381066,2014,"Guo WJ, et al.","SWEET17, a facilitative transporter, mediates fructose transport across the tonoplast of Arabidopsis roots and leaves."
14756317,,,GFP,,http://www.ncbi.nlm.nih.gov/pubmed/14756317,2003,"Ziemienowicz A, et al.",Arabidopsis transportin1 is the nuclear import receptor for the circadian clock-regulated RNA-binding protein AtGRP7
21294843,,,GFP,,http://www.ncbi.nlm.nih.gov/pubmed/21294843,2011,"Glaring MA, et al.","Starch-binding domains in the CBM45 family--low-affinity domains from glucan, water dikinase and α-amylase involved in plastidial starch metabolism."
15509858,,,GFP,,http://www.ncbi.nlm.nih.gov/pubmed/15509858,2004,"Nakamura M, et al.",Low concentrations of propyzamide and oryzalin alter microtubule dynamics in Arabidopsis epidermal cells
16905657,,,GFP,,http://www.ncbi.nlm.nih.gov/pubmed/16905657,2006,"Song J, et al.","Arabidopsis EPSIN1 plays an important role in vacuolar trafficking of soluble cargo proteins in plant cells via interactions with clathrin, AP-1, VTI11, and VSR1"
24709150,,,GFP,,http://www.ncbi.nlm.nih.gov/pubmed/24709150,2014,"Yang H, et al.","Characterization of the putative amino acid transporter genes AtCAT2, 3 &4: the tonoplast localized AtCAT2 regulates soluble leaf amino acids."
15342965,,,GFP,,http://www.ncbi.nlm.nih.gov/pubmed/15342965,2004,"Uemura T, et al.",Systematic analysis of SNARE molecules in Arabidopsis: dissection of the post-Golgi network in plant cells
16461582,,,GFP,,http://www.ncbi.nlm.nih.gov/pubmed/16461582,2006,"Dettmer J, et al.",Vacuolar H+-ATPase activity is required for endocytic and secretory trafficking in Arabidopsis
12692311,,,GFP,,http://www.ncbi.nlm.nih.gov/pubmed/12692311,2003,"Yoshimoto N, et al.","Phloem-localizing sulfate transporter, Sultr1;3, mediates re-distribution of sulfur from source to sink organs in Arabidopsis"
27451899,,,GFP,,,2016,Wang P et al.,Arabidopsis NAP1 Regulates the Formation of Autophagosomes.
17485445,,,GFP,,http://www.ncbi.nlm.nih.gov/pubmed/17485445,2007,"Zhu J, et al.",An enhancer mutant of Arabidopsis salt overly sensitive 3 mediates both ion homeostasis and the oxidative stress response
21472856,,,MS/MS,,http://www.ncbi.nlm.nih.gov/pubmed/21472856,2011,"Taylor NL, et al.","The Arabidopsis thaliana 2-D gel mitochondrial proteome: Refining the value of reference maps for assessing protein abundance, contaminants and post-translational modifications."
23921992,,,GFP,,http://www.ncbi.nlm.nih.gov/pubmed/23921992,2013,"Kim MH, et al.",Identification of Arabidopsis BAK1-associating receptor-like kinase 1 (BARK1) and characterization of its gene expression and brassinosteroid-regulated root phenotypes.
28635622,,,GFP,,,2017,Yang X et al.,"The Arabidopsis GPR1 Gene Negatively Affects Pollen Germination, Pollen Tube Growth, and Gametophyte Senescence."
11251102,,,GFP,,http://www.ncbi.nlm.nih.gov/pubmed/11251102,2001,"Millen RS, et al.",Many parallel losses of infA from chloroplast DNA during angiosperm evolution with multiple independent transfers to the nucleus
26974851,,,GFP,,http://dx.doi.org/10.1111/nph.13914,2016,Chen HY et al.,ORA47 (octadecanoid-responsive AP2/ERF-domain transcription factor 47) regulates jasmonic acid and abscisic acid biosynthesis and signaling through binding to a novel cis-element.
16905668,,,GFP,,http://www.ncbi.nlm.nih.gov/pubmed/16905668,2006,"Bang W, et al.",Arabidopsis carboxyl-terminal domain phosphatase-like isoforms share common catalytic and interaction domains but have distinct in planta functions
16729891,,,MS/MS,,http://www.ncbi.nlm.nih.gov/pubmed/16729891,2006,"Feiz L, et al.",Evaluation of cell wall preparations for proteomics: a new procedure for purifying cell walls from Arabidopsis hypocotyls.
11581165,,,GFP,,http://www.ncbi.nlm.nih.gov/pubmed/11581165,2001,"Ballesteros ML, et al.","LAF1, a MYB transcription activator for phytochrome A signaling"
16698946,,,GFP,,http://www.ncbi.nlm.nih.gov/pubmed/16698946,2006,"Sieburth LE, et al.",SCARFACE encodes an ARF-GAP that is required for normal auxin efflux and vein patterning in Arabidopsis
15516501,,,GFP,,http://www.ncbi.nlm.nih.gov/pubmed/15516501,2004,"Wang Q, et al.",Deletion of the chloroplast-localized Thylakoid formation1 gene product in Arabidopsis leads to deficient thylakoid formation and variegated leaves
26884483,,,GFP,,http://dx.doi.org/10.1104/pp.16.00033,2016,Falcone Ferreyra ML et al.,AtPDCD5 Plays a Role in Programmed Cell Death after UV-B Exposure in Arabidopsis.
18643987,,,GFP,,http://www.ncbi.nlm.nih.gov/pubmed/18643987,2008,"Lin SS, et al.",RING1 E3 ligase localizes to plasma membrane lipid rafts to trigger FB1-induced programmed cell death in Arabidopsis.
17999643,,,GFP,,http://www.ncbi.nlm.nih.gov/pubmed/17999643,2008,"Dong CH, et al.",Subcellular co-localization of Arabidopsis RTE1 and ETR1 supports a regulatory role for RTE1 in ETR1 ethylene signaling
24307681,,,GFP,,http://www.ncbi.nlm.nih.gov/pubmed/24307681,2014,"Ding Y, et al.",Exo70E2 is essential for exocyst subunit recruitment and EXPO formation in both plants and animals.
16805728,,,GFP,,http://www.ncbi.nlm.nih.gov/pubmed/16805728,2006,"Lavy M, et al.",Association of Arabidopsis type-II ROPs with the plasma membrane requires a conserved C-terminal sequence motif and a proximal polybasic domain
17999646,,,GFP,,http://www.ncbi.nlm.nih.gov/pubmed/17999646,2008,"Ding L, et al.",Arabidopsis extra-large G proteins (XLGs) regulate root morphogenesis
22815541,,,GFP,,http://www.ncbi.nlm.nih.gov/pubmed/22815541,2012,"Meng L, et al.",A putative nuclear CLE-like (CLEL) peptide precursor regulates root growth in Arabidopsis.
9830017,,,GFP,,http://www.ncbi.nlm.nih.gov/pubmed/9830017,1998,"Noji M, et al.",Isoform-dependent differences in feedback regulation and subcellular localization of serine acetyltransferase involved in cysteine biosynthesis from Arabidopsis thaliana
11489193,,,GFP,,http://www.ncbi.nlm.nih.gov/pubmed/11489193,2001,"Hajdukiewicz PT, et al.",Multiple pathways for Cre/lox-mediated recombination in plastids
11489192,,,GFP,,http://www.ncbi.nlm.nih.gov/pubmed/11489192,2001,"Despres B, et al.",Partial complementation of embryo defective mutations: a general strategy to elucidate gene function
9375397,,,GFP,,http://www.ncbi.nlm.nih.gov/pubmed/9375397,1997,"Nakashima K, et al.","A nuclear gene, erd1, encoding a chloroplast-targeted Clp protease regulatory subunit homolog is not only induced by water stress but also developmentally up-regulated during senescence in Arabidopsis thaliana"
15208387,,,GFP,,http://www.ncbi.nlm.nih.gov/pubmed/15208387,2004,"Raynaud C, et al.",An Arabidopsis homolog of the bacterial cell division inhibitor SulA is involved in plastid division
15208385,,,GFP,,http://www.ncbi.nlm.nih.gov/pubmed/15208385,2004,"daSilva LL, et al.",Endoplasmic reticulum export sites and Golgi bodies behave as single mobile secretory units in plant cells
26616142,,,GFP,,,2016,Yang X et al.,Activation of autophagy by unfolded proteins during endoplasmic reticulum stress.
23275581,,,GFP,,http://www.ncbi.nlm.nih.gov/pubmed/23275581,2012,"Kim TH, et al.",Natural Variation in Small Molecule-Induced TIR-NB-LRR Signaling Induces Root Growth Arrest via EDS1- and PAD4-Complexed R Protein VICTR in Arabidopsis.
18331354,,,GFP,,http://www.ncbi.nlm.nih.gov/pubmed/18331354,2008,"Vainonen JP, et al.","Light regulation of CaS, a novel phosphoprotein in the thylakoid membrane of Arabidopsis thaliana."
12672693,,,GFP,,http://www.ncbi.nlm.nih.gov/pubmed/12672693,2003,"Chinnusamy V, et al.",ICE1: a regulator of cold-induced transcriptome and freezing tolerance in Arabidopsis
9490740,,,GFP,,http://www.ncbi.nlm.nih.gov/pubmed/9490740,1998,"Silverstone AL, et al.",The Arabidopsis RGA gene encodes a transcriptional regulator repressing the gibberellin signal transduction pathway
12805588,,,MS/MS,,http://www.ncbi.nlm.nih.gov/pubmed/12805588,2003,"Borner GH, et al.",Identification of glycosylphosphatidylinositol-anchored proteins in Arabidopsis. A proteomic and genomic analysis
17079265,,,GFP,,http://www.ncbi.nlm.nih.gov/pubmed/17079265,2006,"von Besser K, et al.",Arabidopsis HAP2 (GCS1) is a sperm-specific gene required for pollen tube guidance and fertilization.
12225668,,,GFP,,http://www.ncbi.nlm.nih.gov/pubmed/12225668,2002,"Kirik V, et al.",Functional analysis of the tubulin-folding cofactor C in Arabidopsis thaliana
17938172,,,GFP,,http://www.ncbi.nlm.nih.gov/pubmed/17938172,2007,"Lu B, et al.","A small ATPase protein of Arabidopsis, TGD3, involved in chloroplast lipid import."
19439572,,,GFP,,http://www.ncbi.nlm.nih.gov/pubmed/19439572,2009,"Beaudoin F, et al.",Functional characterization of the Arabidopsis beta-ketoacyl-coenzyme A reductase candidates of the fatty acid elongase.
17683937,,,GFP,,http://www.ncbi.nlm.nih.gov/pubmed/17683937,2007,"Kevei E, et al.",Arabidopsis thaliana circadian clock is regulated by the small GTPase LIP1.
16873450,,,GFP,,http://www.ncbi.nlm.nih.gov/pubmed/16873450,2006,"Narendra S, et al.",The Arabidopsis ascorbate peroxidase 3 is a peroxisomal membrane-bound antioxidant enzyme and is dispensable for Arabidopsis growth and development
23632853,,,GFP,,http://www.ncbi.nlm.nih.gov/pubmed/23632853,2013,"Moreno JE, et al.",Negative feedback control of jasmonate signaling by an alternative splice variant of JAZ10.
16367960,,,GFP,,http://www.ncbi.nlm.nih.gov/pubmed/16367960,2006,"Ono E, et al.",Localization of a flavonoid biosynthetic polyphenol oxidase in vacuoles
15322131,,,MS/MS,,http://www.ncbi.nlm.nih.gov/pubmed/15322131,2004,"Peltier JB, et al.","New functions of the thylakoid membrane proteome of Arabidopsis thaliana revealed by a simple, fast, and versatile fractionation strategy"
17270011,,,GFP,,http://www.ncbi.nlm.nih.gov/pubmed/17270011,2007,"An R, et al.","AtNHX8, a member of the monovalent cation: proton antiporter-1 family in Arabidopsis thaliana, encodes a putative Li/H antiporter"
19594707,,,GFP,,http://www.ncbi.nlm.nih.gov/pubmed/19594707,2009,"Singh T, et al.",Molecular components required for the targeting of PEX7 to peroxisomes in Arabidopsis thaliana.
17270015,,,GFP,,http://www.ncbi.nlm.nih.gov/pubmed/17270015,2007,"Levy A, et al.","A plasmodesmata-associated beta-1,3-glucanase in Arabidopsis"
14688290,,,GFP,,http://www.ncbi.nlm.nih.gov/pubmed/14688290,2004,"Kim C, et al.",Substrate-dependent and organ-specific chloroplast protein import in planta
17220364,,,GFP,,http://www.ncbi.nlm.nih.gov/pubmed/17220364,2007,"Achard P, et al.",DELLAs contribute to plant photomorphogenesis
16169966,,,GFP,,http://www.ncbi.nlm.nih.gov/pubmed/16169966,2005,"Sparkes IA, et al.",AtPEX2 and AtPEX10 are targeted to peroxisomes independently of known endoplasmic reticulum trafficking routes
14675455,,,GFP,,http://www.ncbi.nlm.nih.gov/pubmed/14675455,2003,"Deveaux Y, et al.",The ethanol switch: a tool for tissue-specific gene induction during plant development
25714357,,,GFP,,http://doi.org/10.1371/journal.pone.0118122,2015,Cayla T et al.,Live imaging of companion cells and sieve elements in Arabidopsis leaves.
15486104,,,GFP,,http://www.ncbi.nlm.nih.gov/pubmed/15486104,2004,"Swarup R, et al.",Structure-function analysis of the presumptive Arabidopsis auxin permease AUX1
14576283,,,GFP,,http://www.ncbi.nlm.nih.gov/pubmed/14576283,2003,"Liu LH, et al.",Urea transport by nitrogen-regulated tonoplast intrinsic proteins in Arabidopsis
11532937,,,GFP,,http://www.ncbi.nlm.nih.gov/pubmed/11532937,2001,"Ueda T, et al.","Ara6, a plant-unique novel type Rab GTPase, functions in the endocytic pathway of Arabidopsis thaliana"
15673576,,,GFP,,http://www.ncbi.nlm.nih.gov/pubmed/15673576,2005,"Carles CC, et al.",ULTRAPETALA1 encodes a SAND domain putative transcriptional regulator that controls shoot and floral meristem activity in Arabidopsis
11971134,,,GFP,,http://www.ncbi.nlm.nih.gov/pubmed/11971134,2002,"Fu Y, et al.",The ROP2 GTPase controls the formation of cortical fine F-actin and the early phase of directional cell expansion during Arabidopsis organogenesis
16356755,,,MS/MS,,http://www.ncbi.nlm.nih.gov/pubmed/16356755,2006,"Jamet E, et al.",Cell wall proteins: a new insight through proteomics
14576288,,,GFP,,http://www.ncbi.nlm.nih.gov/pubmed/14576288,2003,"Sparkes IA, et al.","An Arabidopsis pex10 null mutant is embryo lethal, implicating peroxisomes in an essential role during plant embryogenesis"
26980300,,,GFP,,http://dx.doi.org/10.1080/15476286.2016.1154252,2016,Palm D et al.,Proteome distribution between nucleoplasm and nucleolus and its relation to ribosome biogenesis in Arabidopsis thaliana.
22730405,,,GFP,,http://www.ncbi.nlm.nih.gov/pubmed/22730405,2012,"Hua D, et al.","A plasma membrane receptor kinase, GHR1, mediates abscisic acid- and hydrogen peroxide-regulated stomatal movement in Arabidopsis."
23221595,,,GFP,,http://www.ncbi.nlm.nih.gov/pubmed/23221595,2012,"Liu J, et al.","PSBP-DOMAIN PROTEIN1, a Nuclear-Encoded Thylakoid Lumenal Protein, Is Essential for Photosystem I Assembly in Arabidopsis."
22623516,,,GFP,,http://www.ncbi.nlm.nih.gov/pubmed/22623516,2012,"Waters MT, et al.",The Arabidopsis Ortholog of Rice DWARF27 Acts Upstream of MAX1 in the Control of Plant Development by Strigolactones.
14675432,,,GFP,,http://www.ncbi.nlm.nih.gov/pubmed/14675432,2004,"Ottenhof HH, et al.",Organisation of the pantothenate (vitamin B5) biosynthesis pathway in higher plants
16709200,,,GFP,,http://www.ncbi.nlm.nih.gov/pubmed/16709200,2006,"Arrivault S, et al.",The Arabidopsis metal tolerance protein AtMTP3 maintains metal homeostasis by mediating Zn exclusion from the shoot under Fe deficiency and Zn oversupply
18710496,,,GFP,,http://www.ncbi.nlm.nih.gov/pubmed/18710496,2008,"Küfner I, et al.",Stress regulated members of the plant organic cation transporter family are localized to the vacuolar membrane.
17286797,,,GFP,,http://www.ncbi.nlm.nih.gov/pubmed/17286797,2007,"Kojima H, et al.","Sugar-inducible expression of the nucleolin-1 gene of Arabidopsis thaliana and its role in ribosome synthesis, growth and development"
12148535,,,GFP,,http://www.ncbi.nlm.nih.gov/pubmed/12148535,2002,"Tamura K, et al.",Identification of Ku70 and Ku80 homologues in Arabidopsis thaliana: evidence for a role in the repair of DNA double-strand breaks
25900983,,,MS/MS,,http://doi.org/10.1074/mcp.M115.050286,2015,Heard W et al.,Identification of Regulatory and Cargo Proteins of Endosomal and Secretory Pathways in Arabidopsis thaliana by Proteomic Dissection.
20180920,,,GFP,,http://www.ncbi.nlm.nih.gov/pubmed/20180920,2010,"Kitamura S, et al.",Metabolic profiling and cytological analysis of proanthocyanidins in immature seeds of Arabidopsis thaliana flavonoid accumulation mutants.
16428596,,,GFP,,http://www.ncbi.nlm.nih.gov/pubmed/16428596,2006,"Zhao Q, et al.","Identification and characterization of the Arabidopsis orthologs of nuclear transport factor 2, the nuclear import factor of ran"
11060042,,,GFP,,http://www.ncbi.nlm.nih.gov/pubmed/11060042,2000,"Giglione C, et al.",Identification of eukaryotic peptide deformylases reveals universality of N-terminal protein processing mechanisms
11706177,,,GFP,,http://www.ncbi.nlm.nih.gov/pubmed/11706177,2001,"Koizumi N, et al.","Molecular characterization of two Arabidopsis Ire1 homologs, endoplasmic reticulum-located transmembrane protein kinases"
17369373,,,GFP,,http://www.ncbi.nlm.nih.gov/pubmed/17369373,2007,"Miao Y, et al.",The antagonist function of Arabidopsis WRKY53 and ESR/ESP in leaf senescence is modulated by the jasmonic and salicylic acid equilibrium.
23404887,,,GFP,,http://www.ncbi.nlm.nih.gov/pubmed/23404887,2013,"Huang XY, et al.",CYCLIN-DEPENDENT KINASE G1 is associated with the spliceosome to regulate CALLOSE SYNTHASE5 splicing and pollen wall formation in Arabidopsis.
10555304,,,GFP,,http://www.ncbi.nlm.nih.gov/pubmed/10555304,1999,"Kanamaru K, et al.",Plastidic RNA polymerase sigma factors in Arabidopsis
18036201,,,GFP,,http://www.ncbi.nlm.nih.gov/pubmed/18036201,2008,"Garcia M, et al.",An Arabidopsis homolog of the bacterial peptidoglycan synthesis enzyme MurE has an essential role in chloroplast development.
23404889,,,GFP,,http://www.ncbi.nlm.nih.gov/pubmed/23404889,2013,"Dai M, et al.",The PP6 phosphatase regulates ABI5 phosphorylation and abscisic acid signaling in Arabidopsis.
16412079,,,GFP,,http://www.ncbi.nlm.nih.gov/pubmed/16412079,2006,"Lefebvre V, et al.",Functional analysis of Arabidopsis NCED6 and NCED9 genes indicates that ABA synthesized in the endosperm is involved in the induction of seed dormancy
23512856,,,GFP,,http://www.ncbi.nlm.nih.gov/pubmed/23512856,2013,"Vaughan MM, et al.",Formation of the unusual semivolatile diterpene rhizathalene by the Arabidopsis class I terpene synthase TPS08 in the root stele is involved in defense against belowground herbivory.
23512855,,,GFP,,http://www.ncbi.nlm.nih.gov/pubmed/23512855,2013,"Yoon GM, et al.",14-3-3 regulates 1-aminocyclopropane-1-carboxylate synthase protein turnover in Arabidopsis.
16581911,,,GFP,,http://www.ncbi.nlm.nih.gov/pubmed/16581911,2006,"Lee JY, et al.",Transcriptional and posttranscriptional regulation of transcription factor expression in Arabidopsis roots
20197505,,,MS/MS,,http://www.ncbi.nlm.nih.gov/pubmed/20197505,2010,"Klodmann J, et al.",Internal architecture of mitochondrial complex I from Arabidopsis thaliana.
11106401,,,GFP,,http://www.ncbi.nlm.nih.gov/pubmed/11106401,2000,"Kastenmayer JP, et al.","Novel features of the XRN-family in Arabidopsis: evidence that AtXRN4, one of several orthologs of nuclear Xrn2p/Rat1p, functions in the cytoplasm."
12947042,,,GFP,,http://www.ncbi.nlm.nih.gov/pubmed/12947042,2003,"Emmerlich V, et al.",The plant homolog to the human sodium/dicarboxylic cotransporter is the vacuolar malate carrier
24187546,,,GFP,,http://www.ncbi.nlm.nih.gov/pubmed/24187546,2013,"Sattarzadeh A, et al.",Arabidopsis myosin XI sub-domains homologous to the yeast myo2p organelle inheritance sub-domain target subcellular structures in plant cells.
16286448,,,GFP,,http://www.ncbi.nlm.nih.gov/pubmed/16286448,2005,"Hou X, et al.","Involvement of a cell wall-associated kinase, WAKL4, in Arabidopsis mineral responses"
11449048,,,GFP,,http://www.ncbi.nlm.nih.gov/pubmed/11449048,2001,"Jin JB, et al.","A new dynamin-like protein, ADL6, is involved in trafficking from the trans-Golgi network to the central vacuole in Arabidopsis"
16980563,,,GFP,,http://www.ncbi.nlm.nih.gov/pubmed/16980563,2006,"Rowland O, et al.",CER4 encodes an alcohol-forming fatty acyl-coenzyme A reductase involved in cuticular wax production in Arabidopsis
16980567,,,GFP,,http://www.ncbi.nlm.nih.gov/pubmed/16980567,2006,"Miao Y, et al.",Localization of green fluorescent protein fusions with the seven Arabidopsis vacuolar sorting receptors to prevacuolar compartments in tobacco BY-2 cells
15155879,,,GFP,,http://www.ncbi.nlm.nih.gov/pubmed/15155879,2004,"Bauer D, et al.","Constitutive photomorphogenesis 1 and multiple photoreceptors control degradation of phytochrome interacting factor 3, a transcription factor required for light signaling in Arabidopsis"
17666025,,,GFP,,http://www.ncbi.nlm.nih.gov/pubmed/17666025,2007,"Nelson BK, et al.",A multicolored set of in vivo organelle markers for co-localization studies in Arabidopsis and other plants
15347786,,,GFP,,http://www.ncbi.nlm.nih.gov/pubmed/15347786,2004,"Xu Q, et al.",A second protein L-isoaspartyl methyltransferase gene in Arabidopsis produces two transcripts whose products are sequestered in the nucleus
19395683,,,GFP,,http://www.ncbi.nlm.nih.gov/pubmed/19395683,2009,"Kang YH, et al.",The MYB23 gene provides a positive feedback loop for cell fate specification in the Arabidopsis root epidermis.
15827031,,,GFP,,http://www.ncbi.nlm.nih.gov/pubmed/15827031,2005,"Bhushan S, et al.","Catalysis, subcellular localization, expression and evolution of the targeting peptides degrading protease, AtPreP2"
26243620,,,GFP,,http://doi.org/10.1104/pp.15.00646,2015,Hu H et al.,Distinct Cellular Locations of Carbonic Anhydrases Mediate Carbon Dioxide Control of Stomatal Movements.
22849572,,,GFP,,http://www.ncbi.nlm.nih.gov/pubmed/22849572,2012,"Schiller M, et al.",The Arabidopsis apyrase AtAPY1 is localized in the Golgi instead of the extracellular space.
24574485,,,GFP,,http://www.ncbi.nlm.nih.gov/pubmed/24574485,2014,"Butt H, et al.",Expression analysis of Arabidopsis XH/XS-domain proteins indicates overlapping and distinct functions for members of this gene family.
15565288,,,GFP,,http://www.ncbi.nlm.nih.gov/pubmed/15565288,2005,"Schneidereit A, et al.","AtSTP11, a pollen tube-specific monosaccharide transporter in Arabidopsis"
23841539,,,GFP,,http://www.ncbi.nlm.nih.gov/pubmed/23841539,2013,"Xu L, et al.",The dual targeting ability of type II NAD(P)H dehydrogenases arose early in land plant evolution.
27219122,,,GFP,,,2016,Kunz HH et al.,Small Molecule DFPM Derivative-Activated Plant Resistance Protein Signaling in Roots Is Unaffected by EDS1 Subcellular Targeting Signal and Chemical Genetic Isolation of victr R-Protein Mutants.
25122472,,,MS/MS,,http://doi.org/10.1104/pp.114.245589,2014,Nikolovski N et al.,Label-free protein quantification for plant Golgi protein localization and abundance.
16928693,,,GFP,,http://www.ncbi.nlm.nih.gov/pubmed/16928693,2006,"Dhonukshe P, et al.",Arabidopsis tubulin folding cofactor B interacts with alpha-tubulin in vivo
12837943,,,GFP,,http://www.ncbi.nlm.nih.gov/pubmed/12837943,2003,"Escobar NM, et al.",High-throughput viral expression of cDNA-Green fluorescent protein fusions reveals novel subcellular addresses and identifies unique proteins that interact with plasmodesmata
19843523,,,GFP,,http://www.ncbi.nlm.nih.gov/pubmed/19843523,2009,"Sakuraba Y, et al.",Determination of a chloroplast degron in the regulatory domain of chlorophyllide a oxygenase.
12837948,,,GFP,,http://www.ncbi.nlm.nih.gov/pubmed/12837948,2003,"Lapik YR, et al.",The Arabidopsis cupin domain protein AtPirin1 interacts with the G protein alpha-subunit GPA1 and regulates seed germination and early seedling development
23645632,,,GFP,,http://www.ncbi.nlm.nih.gov/pubmed/23645632,2013,"Cui X, et al.",Ubiquitin-specific proteases UBP12 and UBP13 act in circadian clock and photoperiodic flowering regulation in Arabidopsis.
28338876,,,GFP,,,2017,Bross CD et al.,Subcellular localization of Arabidopsis arogenate dehydratases suggests novel and non-enzymatic roles.
11115896,,,GFP,,http://www.ncbi.nlm.nih.gov/pubmed/11115896,2000,"Geisler M, et al.",The ACA4 gene of Arabidopsis encodes a vacuolar membrane calcium pump that improves salt tolerance in yeast
23297417,,,GFP,,http://www.ncbi.nlm.nih.gov/pubmed/23297417,2013,"Cui S, et al.",Proteomic Analysis Reveals That the Rab GTPase RabE1c Is Involved in the Degradation of the Peroxisomal Protein Receptor PEX7 (Peroxin 7).
10205059,,,GFP,,http://www.ncbi.nlm.nih.gov/pubmed/10205059,1999,"Hoecker U, et al.","SPA1, a WD-repeat protein specific to phytochrome A signal transduction"
15494553,,,GFP,,http://www.ncbi.nlm.nih.gov/pubmed/15494553,2004,"Hwang HH, et al.","Plant proteins that interact with VirB2, the Agrobacterium tumefaciens pilin protein, mediate plant transformation"
15494556,,,GFP,,http://www.ncbi.nlm.nih.gov/pubmed/15494556,2004,"Yoshimoto K, et al.","Processing of ATG8s, ubiquitin-like proteins, and their deconjugation by ATG4s are essential for plant autophagy"
