16377759,,,GFP,,http://www.ncbi.nlm.nih.gov/pubmed/16377759,2006,"Mahfouz MM, et al.","Arabidopsis TARGET OF RAPAMYCIN interacts with RAPTOR, which regulates the activity of S6 kinase in response to osmotic stress signals"
12932321,,,GFP,,http://www.ncbi.nlm.nih.gov/pubmed/12932321,2003,"Grebe M, et al.",Arabidopsis sterol endocytosis involves actin-mediated trafficking via ARA6-positive early endosomes
22095047,,,GFP,,http://www.ncbi.nlm.nih.gov/pubmed/22095047,2012,"Cheng MC, et al.","Arabidopsis RGLG2, functioning as a RING E3 ligase, interacts with AtERF53 and negatively regulates the plant drought stress response."
23549413,,,MS/MS,,http://www.ncbi.nlm.nih.gov/pubmed/23549413,2013,"Dell'Aglio E, et al.",Complementary biochemical approaches applied to the identification of plastidial calmodulin-binding proteins.
18543065,,,GFP,,http://www.ncbi.nlm.nih.gov/pubmed/18543065,2008,"Kmiec-Wisniewska B, et al.","Plant mitochondrial rhomboid, AtRBL12, has different substrate specificity from its yeast counterpart."
15159625,,,GFP,,http://www.ncbi.nlm.nih.gov/pubmed/15159625,2004,"Li HY, et al.","Arabidopsis Acyl-CoA-binding protein ACBP2 interacts with an ethylene-responsive element-binding protein, AtEBP, via its ankyrin repeats"
22147518,,,GFP,,http://www.ncbi.nlm.nih.gov/pubmed/22147518,2012,"Christ B, et al.","MES16, a Member of the Methylesterase Protein Family, Specifically Demethylates Fluorescent Chlorophyll Catabolites during Chlorophyll Breakdown in Arabidopsis."
19211700,,,GFP,,http://www.ncbi.nlm.nih.gov/pubmed/19211700,2009,"Fragoso S, et al.",SnRK1 isoforms AKIN10 and AKIN11 are differentially regulated in Arabidopsis plants under phosphate starvation.
25702284,,,GFP,,http://doi.org/10.1007/s11103-015-0297-y,2015,Hegedus DD et al.,Multiple internal sorting determinants can contribute to the trafficking of cruciferin to protein storage vacuoles.
12032082,,,GFP,,http://www.ncbi.nlm.nih.gov/pubmed/12032082,2002,"Lee H, et al.","LOS2, a genetic locus required for cold-responsive gene transcription encodes a bi-functional enolase"
24006285,,,GFP,,http://www.ncbi.nlm.nih.gov/pubmed/24006285,2013,"Hsu PK, et al.","Two phloem nitrate transporters, NRT1.11 and NRT1.12, are important for redistributing xylem-borne nitrate to enhance plant growth."
20732973,,,GFP,,http://www.ncbi.nlm.nih.gov/pubmed/20732973,2010,"Quilichini TD, et al.",ATP-binding cassette transporter G26 is required for male fertility and pollen exine formation in Arabidopsis.
ISI:000168896800014,,,GFP,,http://dx.doi.org/10.1078/0176-1617-00316,2001,"Humphrey TV, et al.",Re-evaluation of the cytokinin receptor role of the Arabidopsis gene GCR1
16157873,,,GFP,,http://www.ncbi.nlm.nih.gov/pubmed/16157873,2005,"Tambasco-Studart M, et al.",Vitamin B6 biosynthesis in higher plants
26530087,,,GFP,,,2015,Wagner S et al.,The EF-Hand Ca2+ Binding Protein MICU Choreographs Mitochondrial Ca2+ Dynamics in Arabidopsis.
16287169,,,MS/MS,,http://www.ncbi.nlm.nih.gov/pubmed/16287169,2006,"Bayer EM, et al.",Arabidopsis cell wall proteome defined using multidimensional protein identification technology
23321422,,,GFP,,http://www.ncbi.nlm.nih.gov/pubmed/23321422,2013,"Frémont N, et al.",The Arabidopsis TUMOR PRONE5 Gene Encodes an Acetylornithine Aminotransferase Required for Arginine Biosynthesis and Root Meristem Maintenance in Blue Light.
15546360,,,GFP,,http://www.ncbi.nlm.nih.gov/pubmed/15546360,2004,"Ueda T, et al.",Functional differentiation of endosomes in Arabidopsis cells
26721862,,,GFP,,,2016,Fuchs R et al.,Immobilized Subpopulations of Leaf Epidermal Mitochondria Mediate PENETRATION2-Dependent Pathogen Entry Control in Arabidopsis.
12768414,,,GFP,,http://www.ncbi.nlm.nih.gov/pubmed/12768414,2003,"Khazi FR, et al.",An Arabidopsis homologue of bacterial RecA that complements an E. coli recA deletion is targeted to plant mitochondria
19805190,,,GFP,,http://www.ncbi.nlm.nih.gov/pubmed/19805190,2009,"Stonebloom S, et al.",Loss of the plant DEAD-box protein ISE1 leads to defective mitochondria and increased cell-to-cell transport via plasmodesmata.
18298671,,,GFP,,http://www.ncbi.nlm.nih.gov/pubmed/18298671,2008,"Moes D, et al.",Nuclear localization of the mutant protein phosphatase abi1 is required for insensitivity towards ABA responses in Arabidopsis.
15276431,,,MS/MS,,http://www.ncbi.nlm.nih.gov/pubmed/15276431,2004,"Brugiere S, et al.",The hydrophobic proteome of mitochondrial membranes from Arabidopsis cell suspensions
24724701,,,GFP,,http://www.ncbi.nlm.nih.gov/pubmed/24724701,2014,"Khan A, et al.",The Arabidopsis STRESS RESPONSE SUPPRESSOR DEAD-box RNA helicases are nucleolar- and chromocenter-localized proteins that undergo stress-mediated relocalization and are involved in epigenetic gene silencing.
19860740,,,GFP,,http://www.ncbi.nlm.nih.gov/pubmed/19860740,2010,"Gisk B, et al.",Characterization of the haem oxygenase protein family in Arabidopsis  thaliana reveals a diversity of functions.
16251277,,,GFP,,http://www.ncbi.nlm.nih.gov/pubmed/16251277,2005,"Duchene AM, et al.",Dual targeting is the rule for organellar aminoacyl-tRNA synthetases in Arabidopsis thaliana
17873093,,,GFP,,http://www.ncbi.nlm.nih.gov/pubmed/17873093,2007,"Ambrose JC, et al.",The Arabidopsis CLASP gene encodes a microtubule-associated protein involved in cell expansion and division
23162070,,,GFP,,http://www.ncbi.nlm.nih.gov/pubmed/23162070,2013,"Kimura S, et al.",The CBL-interacting protein kinase CIPK26 is a novel interactor of Arabidopsis NADPH oxidase AtRbohF that negatively modulates its ROS-producing activity in a heterologous expression system.
25588388,,,GFP,,http://doi.org/10.1093/pcp/pcu214,2015,Kimura Y et al.,"A flowering integrator, SOC1, affects stomatal opening in Arabidopsis thaliana."
26105742,,,GFP,,http://doi.org/10.1186/s12870-015-0554-x,2015,Rai MI et al.,The ARGOS gene family functions in a negative feedback loop to desensitize plants to ethylene.
15703061,,,GFP,,http://www.ncbi.nlm.nih.gov/pubmed/15703061,2005,"Stone JM, et al.","Arabidopsis AtSPL14, a plant-specific SBP-domain transcription factor, participates in plant development and sensitivity to fumonisin B1"
25253450,,,GFP,,http://doi.org/10.1007/s00299-014-1688-2,2015,Lee SB et al.,AtERF15 is a positive regulator of ABA response.
21950843,,,GFP,,http://www.ncbi.nlm.nih.gov/pubmed/21950843,2012,"Ducluzeau AL, et al.",Gene network reconstruction identifies the authentic trans-prenyl diphosphate synthase that makes the solanesyl moiety of ubiquinone-9 in Arabidopsis.
10798620,,,GFP,,http://www.ncbi.nlm.nih.gov/pubmed/10798620,2000,"Bischoff F, et al.",Localization of AtROP4 and AtROP6 and interaction with the guanine nucleotide dissociation inhibitor AtRhoGDI1 from Arabidopsis
11402190,,,GFP,,http://www.ncbi.nlm.nih.gov/pubmed/11402190,2001,"Daschner K, et al.",The mitochondrial isovaleryl-coenzyme a dehydrogenase of arabidopsis oxidizes intermediates of leucine and valine catabolism
12456757,,,GFP,,http://www.ncbi.nlm.nih.gov/pubmed/12456757,2003,"Cheung AY, et al.",Regulation of pollen tube growth by Rac-like GTPases
18998720,,,MS/MS,,http://www.ncbi.nlm.nih.gov/pubmed/18998720,2009,"Cheng FY, et al.",Absolute protein quantification by LC/MS(E) for global analysis of salicylic acid-induced plant protein secretion responses.
19889877,,,GFP,,http://www.ncbi.nlm.nih.gov/pubmed/19889877,2010,"Saavedra X, et al.",The nuclear interactor PYL8/RCAR3 of Fagus sylvatica FsPP2C1 is a positive regulator of abscisic acid signaling in seeds and stress.
23543785,,,GFP,,http://www.ncbi.nlm.nih.gov/pubmed/23543785,2013,"Traverso JA, et al.",Roles of N-terminal fatty acid acylations in membrane compartment partitioning: Arabidopsis h-type thioredoxins as a case study.
17500056,,,GFP,,http://www.ncbi.nlm.nih.gov/pubmed/17500056,2007,"Li JF, et al.",Organelle targeting of myosin XI is mediated by two globular tail subdomains with separate cargo binding sites.
24134884,,,"MS/MS,GFP",,http://www.ncbi.nlm.nih.gov/pubmed/24134884,2013,"Hamada T, et al.",Purification and characterization of novel microtubule-associated proteins from Arabidopsis cell suspension cultures.
22456678,,,GFP,,http://www.ncbi.nlm.nih.gov/pubmed/22456678,2012,"Lü B, et al.",AT14A mediates the cell wall-plasma membrane-cytoskeleton continuum in Arabidopsis thaliana cells.
22577184,,,GFP,,http://www.ncbi.nlm.nih.gov/pubmed/22577184,2012,"Montesinos JC, et al.",Coupled transport of Arabidopsis p24 proteins at the ER-Golgi interface.
12403712,,,GFP,,http://www.ncbi.nlm.nih.gov/pubmed/12403712,2002,"Wada T, et al.","Role of a positive regulator of root hair development, CAPRICE, in Arabidopsis root epidermal cell differentiation"
23924631,,,GFP,,http://www.ncbi.nlm.nih.gov/pubmed/23924631,2013,"Fan L, et al.",Dynamic analysis of Arabidopsis AP2 σ subunit reveals a key role in clathrin-mediated endocytosis and plant development.
11414611,,,GFP,,http://www.ncbi.nlm.nih.gov/pubmed/11414611,2001,"Dong CH, et al.","Molecular identification and characterization of the Arabidopsis AtADF1, AtADFS and AtADF6 genes"
15197266,,,GFP,,http://www.ncbi.nlm.nih.gov/pubmed/15197266,2004,"Schiott M, et al.",A plant plasma membrane Ca2+ pump is required for normal pollen tube growth and fertilization
21826108,,,"MS/MS,GFP",,http://www.ncbi.nlm.nih.gov/pubmed/21826108,2012,"Drakakaki G, et al.",Isolation and proteomic analysis of the SYP61 compartment reveal its role in exocytic trafficking in Arabidopsis.
24722992,,,GFP,,http://www.ncbi.nlm.nih.gov/pubmed/24722992,2014,"Yasuda S, et al.",Phosphorylation of Arabidopsis ubiquitin ligase ATL31 is critical for plant carbon/nitrogen nutrient balance response and controls the stability of 14-3-3 proteins.
15821981,,,MS/MS,,http://www.ncbi.nlm.nih.gov/pubmed/15821981,2005,"Giavalisco P, et al.",High heterogeneity within the ribosomal proteins of the Arabidopsis thaliana 80S ribosome
10824085,,,GFP,,http://www.ncbi.nlm.nih.gov/pubmed/10824085,2000,"Peeters NM, et al.",Duplication and quadruplication of Arabidopsis thaliana cysteinyl- and asparaginyl-tRNA synthetase genes of organellar origin
24872594,,,MS/MS,,http://doi.org/10.1074/mcp.M114.040923,2014,Tomizioli M et al.,Deciphering thylakoid sub-compartments using a mass spectrometry-based approach.
11258484,,,GFP,,http://www.ncbi.nlm.nih.gov/pubmed/11258484,2000,"Hedtke B, et al.",One RNA polymerase serving two genomes
15505206,,,GFP,,http://www.ncbi.nlm.nih.gov/pubmed/15505206,2004,"Becker D, et al.","AtTPK4, an Arabidopsis tandem-pore K+ channel, poised to control the pollen membrane voltage in a pH- and Ca2+-dependent manner"
22430844,,,"MS/MS,GFP",,http://www.ncbi.nlm.nih.gov/pubmed/22430844,2012,"Parsons HT, et al.",Isolation and proteomic characterization of the Arabidopsis Golgi defines functional and novel components involved in plant cell wall biosynthesis.
27122571,,,MS/MS,,http://dx.doi.org/10.1093/jxb/erw165,2016,Fromm S et al.,Life without complex I: proteome analyses of an Arabidopsis mutant lacking the mitochondrial NADH dehydrogenase complex.
12631323,,,GFP,,http://www.ncbi.nlm.nih.gov/pubmed/12631323,2003,"Igarashi D, et al.",Identification of photorespiratory glutamate:glyoxylate aminotransferase (GGAT) gene in Arabidopsis
15726812,,,GFP,,http://www.ncbi.nlm.nih.gov/pubmed/15726812,2004,"Suo Y, et al.",Regulation of nucleocytoplasmic localization of the atDjC6 chaperone protein
19220478,,,GFP,,http://doi.org/10.1111/j.1567-1364.2009.00483.x,2009,Froissard M et al.,"Heterologous expression of AtClo1, a plant oil body protein, induces lipid accumulation in yeast."
22522809,,,MS/MS,,http://www.ncbi.nlm.nih.gov/pubmed/22522809,2012,"Hummel M, et al.",Dynamic protein composition of Arabidopsis thaliana cytosolic ribosomes in response to sucrose feeding as revealed by label free MSE proteomics.
11703093,,,GFP,,http://www.ncbi.nlm.nih.gov/pubmed/11703093,2001,"Andreeva AV, et al.",Nuclear localization of the plant protein Ser/Thr phosphatase PP7
23430044,,,GFP,,http://www.ncbi.nlm.nih.gov/pubmed/23430044,2013,"Chanroj S, et al.",K+ transporter AtCHX17 with its hydrophilic C tail localizes to membranes of the secretory/endocytic system: role in reproduction and seed set.
23793400,,,GFP,,http://www.ncbi.nlm.nih.gov/pubmed/23793400,2013,"Hu G, et al.",A crucial role of the RGS domain in trans-Golgi network export of AtRGS1 in the protein secretory pathway.
12571277,,,GFP,,http://www.ncbi.nlm.nih.gov/pubmed/12571277,2003,"Bouquin T, et al.",The Arabidopsis lue1 mutant defines a katanin p60 ortholog involved in hormonal control of microtubule orientation during cell growth
12147736,,,GFP,,http://www.ncbi.nlm.nih.gov/pubmed/12147736,2002,"Nakamura T, et al.",Molecular cloning and characterization of plant genes encoding novel peroxisomal molybdoenzymes of the sulphite oxidase family
26927949,,,GFP,,http://dx.doi.org/10.1080/09168451.2015.1135042,2016,Noshi M et al.,Redox regulation of ascorbate and glutathione by a chloroplastic dehydroascorbate reductase is required for high-light stress tolerance in Arabidopsis.
15659627,,,GFP,,http://www.ncbi.nlm.nih.gov/pubmed/15659627,2005,"Mochizuki S, et al.",The Arabidopsis WAVY GROWTH 2 protein modulates root bending in response to environmental stimuli
15659621,,,GFP,,http://www.ncbi.nlm.nih.gov/pubmed/15659621,2005,"Xu J, et al.",Dissection of Arabidopsis ADP-RIBOSYLATION FACTOR 1 function in epidermal cell polarity
19098073,,,GFP,,http://www.ncbi.nlm.nih.gov/pubmed/19098073,2009,"Enami K, et al.",Differential expression control and polarized distribution of plasma membrane-resident SYP1 SNAREs in Arabidopsis thaliana.
18441219,,,GFP,,http://www.ncbi.nlm.nih.gov/pubmed/18441219,2008,"Berthomé R, et al.","pur4 mutations are lethal to the male, but not the female, gametophyte and affect sporophyte development in Arabidopsis."
16982705,,,GFP,,http://www.ncbi.nlm.nih.gov/pubmed/16982705,2006,"Maurino VG, et al.",Identification and expression analysis of twelve members of the nucleobase-ascorbate transporter (NAT) gene family in Arabidopsis thaliana
23737500,,,GFP,,http://www.ncbi.nlm.nih.gov/pubmed/23737500,2013,"Xiang L, et al.",Trafficking of plant vacuolar invertases: from a membrane-anchored to a soluble status. Understanding sorting information in their complex N-terminal motifs.
18067581,,,GFP,,http://www.ncbi.nlm.nih.gov/pubmed/18067581,2008,"Tamura T, et al.",Signal peptide peptidase and its homologs in Arabidopsis thaliana--plant tissue-specific expression and distinct subcellular localization.
17530285,,,GFP,,http://www.ncbi.nlm.nih.gov/pubmed/17530285,2007,"Damari-Weissler H, et al.",Spinach SoHXK1 is a mitochondria-associated hexokinase
18931021,,,GFP,,http://www.ncbi.nlm.nih.gov/pubmed/18931021,2008,"Gebert M, et al.",F-actin organization and pollen tube tip growth in Arabidopsis are dependent on the gametophyte-specific Armadillo repeat protein ARO1.
10945256,,,GFP,,http://www.ncbi.nlm.nih.gov/pubmed/10945256,2000,"Nishii A, et al.","Characterization of a novel gene encoding a putative single zinc-finger protein, ZIM, expressed during the reproductive phase in Arabidopsis thaliana"
14988495,,,GFP,,http://www.ncbi.nlm.nih.gov/pubmed/14988495,2004,"Arimura S, et al.","Arabidopsis dynamin-like protein 2a (ADL2a), like ADL2b, is involved in plant mitochondrial division"
21738492,,,GFP,,http://doi.org/10.1371/journal.pgen.1002159,2011,Xu S et al.,Transportin-SR is required for proper splicing of resistance genes and plant immunity.
18715957,,,GFP,,http://www.ncbi.nlm.nih.gov/pubmed/18715957,2008,"Oikawa K, et al.",Chloroplast outer envelope protein CHUP1 is essential for chloroplast anchorage to the plasma membrane and chloroplast movement.
27879389,,,GFP,,,2017,Wang HJ et al.,VPS36-Dependent Multivesicular Bodies Are Critical for Plasmamembrane Protein Turnover and Vacuolar Biogenesis.
15246066,,,GFP,,http://www.ncbi.nlm.nih.gov/pubmed/15246066,2004,"Mercier RW, et al.",Yeast hygromycin sensitivity as a functional assay of cyclic nucleotide gated cation channels
15629774,,,GFP,,http://www.ncbi.nlm.nih.gov/pubmed/15629774,2005,"Ren T, et al.",The nuclear localization of the Arabidopsis transcription factor TIP is blocked by its interaction with the coat protein of Turnip crinkle virus
22738204,,,GFP,,http://www.ncbi.nlm.nih.gov/pubmed/22738204,2012,"McLoughlin F, et al.",The Snf1-related protein kinases SnRK2.4 and SnRK2.10 are involved in maintenance of root system architecture during salt stress.
19434422,,,GFP,,http://www.ncbi.nlm.nih.gov/pubmed/19434422,2009,"Mangeon A, et al.","AtGRP5, a vacuole-located glycine-rich protein involved in cell elongation."
11874578,,,GFP,,http://www.ncbi.nlm.nih.gov/pubmed/11874578,2002,"Saint-Jore CM, et al.",Redistribution of membrane proteins between the Golgi apparatus and endoplasmic reticulum in plants is reversible and not dependent on cytoskeletal networks
17426055,,,GFP,,http://www.ncbi.nlm.nih.gov/pubmed/17426055,2007,"Bown L, et al.",The ectopically parting cells 1-2 (epc1-2) mutant exhibits an exaggerated response to abscisic acid
18686298,,,MS/MS,,http://www.ncbi.nlm.nih.gov/pubmed/18686298,2008,"Whiteman SA, et al.",Identification of novel proteins and phosphorylation sites in a tonoplast enriched membrane fraction of Arabidopsis thaliana.
10737809,,,GFP,,http://www.ncbi.nlm.nih.gov/pubmed/10737809,2000,"Cutler SR, et al.",Random GFP::cDNA fusions enable visualization of subcellular structures in cells of Arabidopsis at a high frequency
16624863,,,GFP,,http://www.ncbi.nlm.nih.gov/pubmed/16624863,2006,"Collier S, et al.",A distant coilin homologue is required for the formation of cajal bodies in Arabidopsis
21166475,,,MS/MS,,http://www.ncbi.nlm.nih.gov/pubmed/21166475,2011,"Ito J, et al.",Analysis of the Arabidopsis cytosolic proteome highlights subcellular partitioning of central plant metabolism.
17220198,,,GFP,,http://www.ncbi.nlm.nih.gov/pubmed/17220198,2007,"Ambrose JC, et al.",The kinesin ATK5 functions in early spindle assembly in Arabidopsis
26129778,,,GFP,,http://dx.doi.org/10.1038/ncomms8243,2015,Gao MJ et al.,SCARECROW-LIKE15 interacts with HISTONE DEACETYLASE19 and is essential for repressing the seed maturation programme.
18676662,,,GFP,,http://www.ncbi.nlm.nih.gov/pubmed/18676662,2008,"Zhao J, et al.",AtCHX13 is a plasma membrane K+ transporter.
23424627,,,GFP,,http://www.ncbi.nlm.nih.gov/pubmed/23424627,2013,"Tunc-Ozdemir M, et al.",Cyclic nucleotide gated channels 7 and 8 are essential for male reproductive fertility.
15024409,,,GFP,,http://www.ncbi.nlm.nih.gov/pubmed/15024409,2004,"Xie Z, et al.",Genetic and functional diversification of small RNA pathways in plants
21443605,,,GFP,,http://www.ncbi.nlm.nih.gov/pubmed/21443605,2012,"Inzé A, et al.",A subcellular localization compendium of hydrogen peroxide-induced proteins.
11821043,,,GFP,,http://www.ncbi.nlm.nih.gov/pubmed/11821043,2002,"Schonknecht G, et al.",KCO1 is a component of the slow-vacuolar (SV) ion channel
22664102,,,GFP,,http://www.ncbi.nlm.nih.gov/pubmed/22664102,2012,"Sakamoto H, et al.",Interaction between a plasma membrane-localized ankyrin-repeat protein ITN1 and a nuclear protein RTV1.
15722465,,,GFP,,http://www.ncbi.nlm.nih.gov/pubmed/15722465,2005,"Demidov D, et al.",Identification and dynamics of two classes of aurora-like kinases in Arabidopsis and other plants
15665250,,,GFP,,http://www.ncbi.nlm.nih.gov/pubmed/15665250,2005,"Loque D, et al.",Tonoplast intrinsic proteins AtTIP2;1 and AtTIP2;3 facilitate NH3 transport into the vacuole
21515817,,,GFP,,http://www.ncbi.nlm.nih.gov/pubmed/21515817,2011,"Lee J, et al.",Both the hydrophobicity and a positively charged region flanking the C-terminal region of the transmembrane domain of signal-anchored proteins play critical roles in determining their targeting specificity to the endoplasmic reticulum or endosymbiotic organelles in Arabidopsis cells.
22897245,,,GFP,,http://www.ncbi.nlm.nih.gov/pubmed/22897245,2012,"Luo G, et al.","Four closely-related RING-type E3 ligases, APD1-4, are involved in pollen mitosis II regulation in Arabidopsis."
11719511,,,MS/MS,,http://www.ncbi.nlm.nih.gov/pubmed/11719511,2002,"Schubert M, et al.",Proteome map of the chloroplast lumen of Arabidopsis thaliana
22635117,,,GFP,,http://www.ncbi.nlm.nih.gov/pubmed/22635117,2012,"Song K, et al.",An A/ENTH Domain-Containing Protein Functions as an Adaptor for Clathrin-Coated Vesicles on the Growing Cell Plate in Arabidopsis Root Cells.
11158531,,,GFP,,http://www.ncbi.nlm.nih.gov/pubmed/11158531,2001,"Kushnir S, et al.",A mutation of the mitochondrial ABC transporter Sta1 leads to dwarfism and chlorosis in the Arabidopsis mutant starik
22635113,,,GFP,,http://www.ncbi.nlm.nih.gov/pubmed/22635113,2012,"Nagano M, et al.",Arabidopsis Sphingolipid Fatty Acid 2-Hydroxylases (AtFAH1 and AtFAH2) Are Functionally Differentiated in Fatty Acid 2-Hydroxylation and Stress Responses.
19174456,,,GFP,,http://www.ncbi.nlm.nih.gov/pubmed/19174456,2009,"Dixon DP, et al.",Enzyme activities and subcellular localization of members of the Arabidopsis glutathione transferase superfamily.
16644739,,,GFP,,http://www.ncbi.nlm.nih.gov/pubmed/16644739,2006,"Barber C, et al.",Distinct properties of the five UDP-D-glucose/UDP-D-galactose 4-epimerase isoforms of Arabidopsis thaliana.
19880612,,,GFP,,http://www.ncbi.nlm.nih.gov/pubmed/19880612,2010,"Agee AE, et al.",MODIFIED VACUOLE PHENOTYPE1 is an Arabidopsis myrosinase-associated protein involved in endomembrane protein trafficking.
25740923,,,MS/MS,,http://doi.org/10.1093/jxb/erv018,2015,Uberegui E et al.,An Arabidopsis soluble chloroplast proteomic analysis reveals the participation of the Executer pathway in response to increased light conditions.
15591448,,,GFP,,http://www.ncbi.nlm.nih.gov/pubmed/15591448,2004,"Lin RC, et al.",Arabidopsis FHY3/FAR1 gene family and distinct roles of its members in light control of arabidopsis development
12602871,,,GFP,,http://www.ncbi.nlm.nih.gov/pubmed/12602871,2003,"Sharma VK, et al.",The Arabidopsis CLV3-like (CLE) genes are expressed in diverse tissues and encode secreted proteins
15598803,,,GFP,,http://www.ncbi.nlm.nih.gov/pubmed/15598803,2005,"Klepek YS, et al.","Arabidopsis POLYOL TRANSPORTER5, a new member of the monosaccharide transporter-like superfamily, mediates H+-Symport of numerous substrates, including myo-inositol, glycerol, and ribose"
23602096,,,GFP,,http://www.ncbi.nlm.nih.gov/pubmed/23602096,2013,"Suzuki T, et al.","Development and disintegration of tapetum-specific lipid-accumulating organelles, elaioplasts and tapetosomes, in Arabidopsis thaliana and Brassica napus."
12968184,,,GFP,,http://www.ncbi.nlm.nih.gov/pubmed/12968184,2003,"Han S, et al.",A cell surface receptor mediates extracellular Ca(2+) sensing in guard cells
14730085,,,MS/MS,,http://www.ncbi.nlm.nih.gov/pubmed/14730085,2004,"Lister R, et al.",A transcriptomic and proteomic characterization of the Arabidopsis mitochondrial protein import apparatus and its response to mitochondrial dysfunction
24637024,,,GFP,,http://www.ncbi.nlm.nih.gov/pubmed/24637024,2014,"Haraguchi T, et al.","Molecular characterization and subcellular localization of Arabidopsis class VIII myosin, ATM1."
18826430,,,GFP,,http://www.ncbi.nlm.nih.gov/pubmed/18826430,2009,"Castaings L, et al.",The nodule inception-like protein 7 modulates nitrate sensing and metabolism in Arabidopsis.
20739301,,,GFP,,http://www.ncbi.nlm.nih.gov/pubmed/20739301,2010,"Toledo-Ortiz G, et al.",Subcellular sites of the signal transduction and degradation of phytochrome A.
20304971,,,GFP,,http://www.ncbi.nlm.nih.gov/pubmed/20304971,2010,"Blum R, et al.",Cytosolic action of phytochelatin synthase.
22010978,,,GFP,,http://www.ncbi.nlm.nih.gov/pubmed/22010978,2012,"Ibl V, et al.",Interactome of the plant-specific ESCRT-III component AtVPS2.2 in Arabidopsis thaliana.
10358052,,,GFP,,http://www.ncbi.nlm.nih.gov/pubmed/10358052,1999,"Zimmermann S, et al.",UV-responsive genes of arabidopsis revealed by similarity to the Gcn4-mediated UV response in yeast
26178734,,,GFP,,http://doi.org/10.1111/jipb.12379,2016,Zhao J et al.,ANAC005 is a membrane-associated transcription factor and regulates vascular development in Arabidopsis.
11565032,,,GFP,,http://www.ncbi.nlm.nih.gov/pubmed/11565032,2001,"Nakajima K, et al.",Intercellular movement of the putative transcription factor SHR in root patterning
16635983,,,MS/MS,,http://www.ncbi.nlm.nih.gov/pubmed/16635983,2006,"Nelson CJ, et al.",A quantitative analysis of Arabidopsis plasma membrane using trypsin-catalyzed (18)O labeling
16461285,,,GFP,,http://www.ncbi.nlm.nih.gov/pubmed/16461285,2006,"Vanstraelen M, et al.",Cell cycle-dependent targeting of a kinesin at the plasma membrane demarcates the division site in plant cells
12853455,,,GFP,,http://www.ncbi.nlm.nih.gov/pubmed/12853455,2003,"Lee KH, et al.",The M domain of atToc159 plays an essential role in the import of proteins into chloroplasts and chloroplast biogenesis
12101128,,,GFP,,http://www.ncbi.nlm.nih.gov/pubmed/12101128,2002,"Shah K, et al.",The Arabidopsis kinase-associated protein phosphatase controls internalization of the somatic embryogenesis receptor kinase 1
16040659,,,GFP,,http://www.ncbi.nlm.nih.gov/pubmed/16040659,2005,"Thompson AR, et al.",Autophagic nutrient recycling in Arabidopsis directed by the ATG8 and ATG12 conjugation pathways
18703057,,,GFP,,http://www.ncbi.nlm.nih.gov/pubmed/18703057,2008,"Carrie C, et al.",Type II NAD(P)H dehydrogenases are targeted to mitochondria and chloroplasts or peroxisomes in Arabidopsis thaliana.
26909945,,,GFP,,http://dx.doi.org/10.4238/gmr.15016378,2016,Luo Q et al.,Overexpression of NaKR3 enhances salt tolerance in Arabidopsis.
16271866,,,GFP,,http://www.ncbi.nlm.nih.gov/pubmed/16271866,2005,"Heisler MG, et al.",Patterns of auxin transport and gene expression during primordium development revealed by live imaging of the Arabidopsis inflorescence meristem
23585650,,,GFP,,http://www.ncbi.nlm.nih.gov/pubmed/23585650,2013,"Chen M, et al.",ACYL-LIPID DESATURASE2 is required for chilling and freezing tolerance in Arabidopsis.
